{
  "version": 2,
  "id": "lab-goon-drop",
  "name": "Patroller Lab / Drop to Rebound",
  "spawn": [2, 3.65],
  "bounds": { "minX": 0, "minY": -4, "maxX": 24, "maxY": 12 },
  "killY": 13,
  "solids": [
    { "id": "takeoff", "rect": { "x": 0, "y": 4, "w": 4, "h": 1 } },
    { "id": "floor", "rect": { "x": 0, "y": 8, "w": 24, "h": 2 } }
  ],
  "anchors": [{ "id": "next-anchor", "position": [11, 2], "radius": 0.4 }],
  "enemies": [
    {
      "id": "goon-drop",
      "kind": "patroller",
      "position": [6.4, 7.5],
      "size": [1.2, 1],
      "path": { "to": [8.2, 7.5], "period": 6 },
      "stomp": { "minDownSpeed": 1, "reboundSpeed": 15, "topInset": 0.12 }
    }
  ]
}
