{
  "version": 1,
  "id": "lab-collision",
  "name": "Collision Stress Lab",
  "spawn": [3, 7],
  "bounds": { "minX": -1, "minY": -8, "maxX": 91, "maxY": 13 },
  "killY": 14,
  "solids": [
    { "id": "wall-left", "rect": { "x": -1, "y": -8, "w": 1, "h": 21 } },
    { "id": "wall-right", "rect": { "x": 90, "y": -8, "w": 1, "h": 21 } },
    { "id": "lethal-floor", "kind": "hazard", "rect": { "x": 0, "y": 12, "w": 90, "h": 1.6 } },

    { "id": "ground-a", "rect": { "x": 0, "y": 8, "w": 14, "h": 4 } },
    { "id": "thin-wall", "rect": { "x": 12.5, "y": 5.6, "w": 0.06, "h": 2.4 } },

    { "id": "seam-0", "rect": { "x": 14, "y": 8, "w": 1, "h": 4 } },
    { "id": "seam-1", "rect": { "x": 15, "y": 8, "w": 1, "h": 4 } },
    { "id": "seam-2", "rect": { "x": 16, "y": 8, "w": 1, "h": 4 } },
    { "id": "seam-3", "rect": { "x": 17, "y": 8, "w": 1, "h": 4 } },
    { "id": "seam-4", "rect": { "x": 18, "y": 8, "w": 1, "h": 4 } },
    { "id": "seam-5", "rect": { "x": 19, "y": 8, "w": 1, "h": 4 } },
    { "id": "seam-6", "rect": { "x": 20, "y": 8, "w": 1, "h": 4 } },
    { "id": "seam-7", "rect": { "x": 21, "y": 8, "w": 1, "h": 4 } },

    { "id": "ground-b", "rect": { "x": 22, "y": 8, "w": 16, "h": 4 } },
    {
      "id": "sharp-spire",
      "points": [
        [23.2, 8],
        [24, 4.5],
        [24.8, 8]
      ]
    },
    {
      "id": "sharp-wedge",
      "points": [
        [26, 8],
        [26, 6.8],
        [29, 8]
      ]
    },
    { "id": "tunnel-roof", "rect": { "x": 30, "y": 5, "w": 6, "h": 2.2 } },

    { "id": "tight-ledge", "rect": { "x": 2, "y": 3.2, "w": 6, "h": 1 } },
    { "id": "tight-roof", "rect": { "x": 2, "y": 0.5, "w": 6, "h": 2.1 } },

    { "id": "thin-plank", "rect": { "x": 40, "y": 9.5, "w": 6, "h": 0.06 } },

    { "id": "ground-c", "rect": { "x": 48, "y": 8, "w": 42, "h": 4 } },
    { "id": "low-ceiling", "rect": { "x": 56.5, "y": 3.2, "w": 6, "h": 0.8 } },

    { "id": "conflict-wall", "rect": { "x": 70, "y": 0, "w": 0.5, "h": 8 } },

    {
      "id": "thorns-release",
      "kind": "hazard",
      "points": [
        [84, 8],
        [84.5, 7],
        [85, 8]
      ]
    },
    { "id": "hazard-strip", "kind": "hazard", "rect": { "x": 87, "y": 3, "w": 0.1, "h": 5 } }
  ],
  "anchors": [
    { "id": "a-pit", "position": [43, 0] },
    { "id": "a-low", "position": [55, 0.5] },
    { "id": "a-tucked", "position": [70.9, 2] },
    { "id": "a-release", "position": [80, 0] }
  ],
  "exit": { "min": [88, 4], "max": [90, 8] }
}
